batch,index,music,hashtag,author,likes,comments,shares,saves
1,0,original sound - Ziro,"horror, nosleep, askreddit, paranormal, reddit_tiktok, redditstories, reddithorror",factsfromziro,137300,471,15900,437
1,4,original sound - Zav,"ocd, germaphobe, narcissist, toxichousehold, asian, bipolar, generationaltrauma, trauma, mentalhealth",zavhbruh,5300000,101100,270200,103200
1,5,Only Love Can Hurt Like This (Slowed Down Version) - Paloma Faith,mtbro,mahendramagar009,243600,17100,47300,98100
1,9,i wouldnt mind wterf11 remix - mereanamordegardglesgorv,,emmalanyi,370600,2042,38900,2879
2,1,original sound - 断袖爱👬🏻♡🏳️‍🌈,,boyslove_x,35700,310,4238,1279
2,4,Stargazing (Slowed + Reverb) - Marcelo De Carvalho,"theythem, hethey, trans, topsurgery",squidgender,50800,297,2318,165
2,5,original sound - RWE,"ote, rwe, basketball",rwe,289800,1556,16900,371
2,6,original sound - Hunter,"weretrend, baseballplayers",itshunterhanes,216300,652,19400,4091
2,7,Astronaut In The Ocean - Masked Wolf,"hack, vaseline, hack",leprestige92,2900000,23100,776200,122100
2,9,original sound - Suuperbro0,basketball,suuperbro0,18100,4288,2177,1163
2,10,everything works out in the end (best part looped) - ciaffa & fedo DJ,"fp, foryou, foryoupage, fyp, lgbtq",vibe_n_smile,311000,9172,27300,3808
2,12,Very Sad - Enchan,"wifi, wifimoney, fypdonggggggg, she, mad, videoviral, fypage%E3%82%B7, fypdonggg, fypage%E3%82%B7%E2%99%A1%E2%9D%A4%EF%B8%8F%F0%9F%A7%BF, video, man, sad, fyppppppppppppppppppppppp, videojuegos2023",videos7240,271900,4609,33500,6464
2,13,original sound - ZACK._.Animals,"foryou, foryoupage, chiropractic, chiropractortiktok, dog, dogsoftiktok, cat, catsoftiktok, animals, pet, petsoftiktok, titokusa, fpy, fpy%E3%82%B7, viral, viralvideo",zack._.animals,3600000,14300,243600,77700
2,18,Monkeys Spinning Monkeys - Kevin MacLeod & Kevin The Monkey,"teachersoftiktok, teachersdressedasstudents, teacherfun, blackteachersontiktok",brittan.ya,3500000,38300,261899,100300
2,21,Aesthetic - Gaspar,,vicblends,979600,1649,43200,1388
2,24,sonido original - Alan (Tyler's version),"foryou, pourtoi, frenchtherian, therian, therianfortherian, quadrobist, quadrobicsjump, quadrobics, theriansafeplace, theriotype",marshall.therian,47800,5546,7554,1826
2,25,original sound - Clapez,"freestyle, rap, music",kaicenatclips155,138600,1933,37600,3412
2,27,Simple Pleasantries - Arthur Benson,"breathalyzer, breathalyzertest",stephenmakesvideos,787000,1161,36800,715
3,1,original sound - border crossing,"agent, bordercrossing, foryou, border, airportlife, fyp, @usaview.us",bordercrossing90,25000,220,2139,405
3,2,原聲 - welovedogs,"dogs, dogsoftiktok, lovelydogs, cutedog",yinweizhou,1700000,21800,161500,108000
3,4,original sound - MedSchoolBro,"fyp, medstudent, medschool, medicalstudent, pharmacology, pharmacy",medschoolbro,102200,199,4088,235
3,6,original sound - ugh madison,,ugh_madison,4400000,10200,287200,28000
3,7,original sound - Co1in,"co1inmyers, twitchclips, streamer, fyp%E3%82%B7",co1inmyersdaily,340900,879,35200,1261
3,11,original sound - Squad House Yacht,handshake,rasemaso,2100000,30900,357100,80600
3,12,original sound - Nathan Legagnoux,"fyp%E3%82%B7%E3%82%9A, foryoupage, specialforces, soldier, military, militaryedit",nathan.legagnoux,620900,4735,156700,25500
3,14,original sound - AkilCurrie,"michaelmyers, michaelmyersprank, michaelmversmask, scareprank, prank, drivethruprank",akilcurrie,650700,2528,80700,4769
3,15,original sound - Pearline,"fyp, bathroomchallange, badword, badwordchallenge",pearlinebrown1,7600000,53500,613500,417900
3,16,original sound - cupcakkes tentacle toy,"fyp, floptok%F0%9F%98%8D%F0%9F%98%8D%F0%9F%98%AD%F0%9F%98%8C%F0%9F%A4%9E%F0%9F%92%85%F0%9F%92%85, floptok, fyp%E3%82%B7",gxr.zz,264700,2274,30800,6405
3,18,original sound - Fuzzy Friends,"dog, dogs, dogsoftiktok, foryoupage, doglovers, funnytiktok, trending, labrador, labradorretriever, blacklab, puppies, puppies, foryou, fy, fyp, viral, funny, viralvideo",fuzzyfriends07,288100,43200,44300,3956
3,21,Snooze - SZA,"@kai_cenat, sza, kaicenat, kai, snooze, rnb, singing, edit",szaglobal,10600,55,1810,126
3,23,original sound - lacie may,"fyp, hi, countrygirl, ford, fordtrucks, minnesota",mnaveragelaciemay,62400,29600,3026,332
3,24,original sound - WrestlingGalaxy,"wwe, wrestling, wrestletok, johncena",wrestlinggalaxy_,4377,41,418,68
4,1,Monkeys Spinning Monkeys - Kevin MacLeod & Kevin The Monkey,,lindang2030,54600,2185,14100,1011
4,5,soak city (do it) - 310babii,"fyp, viraltiktok, dance, kids",swaggboifreddy,87600,424,6574,1196
4,6,original sound - Zav,"asian, generationaltrauma, trauma, toxichousehold, toxic, mentalhealth, childhoodtrauma, npd, narcissistic, ocd, contaminationocd, germaphobe",zavhbruh,1400000,12300,87400,5458
4,7,original sound - The Relationship Hub,,pierson,1800000,9507,106000,12400
4,9,original sound - riley mae,"loyaltytest, streetinterview, interview",rileymae,16700,91,1514,39
4,13,original sound - ANGRY GRANDMA,"fyp, angrygrandma, comedy, shopping, christmas, viral, trending, makethisviral, funny, hilarious, trynottolaughtiktoktv",angrygrandma18,637300,7504,70500,125700
4,14,nymphology - ༺✮༻,"therian, polytherian, therianthropy, theriancommunity, therians, therianeducation, alterhuman, theriotype, theriantiktok, felinetherian, canadianlynx",canus_lupus,24000,1986,5352,249
4,17,original sound - NeverMissAllie,"challenge, basketball, bet, sneakers, viralvideo",nevermissallie,117500,363,5855,128
4,20,original sound - Roman Corona,"funny, funnyvideos, scaryvideos",romancorona6,1100000,17000,101200,89100
4,21,original sound - FallonTonight,"@livbedumb, fallontonight, oliviarodrigo, driverslicense, flowers",fallontonight,2600000,2764,111800,3310
4,24,original sound - ✨MorganWallen🐄✨,"capcut, morgan",morgan_wallen290,20,0,16,1
4,25,original sound - House of Highlights,"@lexlococo, lilbro, fornite, gamertok, @brgaming",houseofhighlights,240200,1364,23000,3814
4,28,TEACH ME HOW TO DRILL - Lil Mabu & Fivio Foreign,"lilmabu, fivioforeign, hood, viral, nerd",lilmabu,2400000,9205,144700,16200
