batch,index,music,hashtag,author,likes,comments,shares,saves
1,1,original sound - user3858328539673,"movie, film, movieclips, foryou, shesoutofmyleague",remimarcy7,338700,483,26900,509
1,3,original sound - Bridgedits,"outerbanks, madelyncline, sarahcameron, johnbroutledge, chasestokes",bridgedits,352100,490,30100,538
1,5,original sound - Food Dudes,"foodhacks, viralrecipe, tiktokfood, chickfila",fooddudescook,1300000,16100,110600,35800
1,6,original sound - ashley rose,,ashleyroseclips,5156,28,365,8
1,7,original sound - Elon Musk,"elonmusk, investing, financialfreedom, stockmarket, investmenttips, wealthbuilding, finance, techinvesting, realestatelnvesting",elon_x_musk0,48600,1325,10200,2164
1,8,original sound - NBA,"nba, basketball, deucetatum, draymondgreen",nba,661000,3035,28100,2179
1,9,original sound - YSK,youshouldknowpodcast,ysk_fanaccount,336400,4248,23100,7580
2,0,"Suspense, horror, piano and music box - takaya","waitforit, wow, hotel, travel",mindblowingreels,127200,3823,37300,4648
2,2,Lovin On Me - Jack Harlow,"jackharlow, lovinonme, cats, rap, hiphop, raptok, cat, catsoftiktok, fyp",chillestcat,1700000,20400,203900,76600
2,4,Lovin On Me - Jack Harlow,"fyp, egirl, viral, fakebody",daisybloomss,43700,255,2563,149
2,7,Originalton - dxstxn.18,,meme_hub2212,202700,2227,32400,6319
2,10,original sound - Prison Stories,,lockeddup,171900,403,14200,183
2,11,original sound - Sierra Larson,"fyp, fypage, trendy, romantoolit, thanksgiving",theonlyromantoolit,96900,661,16200,353
2,12,original sound - SouthernBoyzOutdoor,"fyu, jambalaya, louisiana",southernboyzoutdoors,77100,728,5080,1026
2,23,original sound - Upprovement,"relationship, streetinterview, women, rizz, dating",upprovement,32700,58,2458,92
2,25,original sound - Bonnie Engle ❤️,"foryoupage, family, comdey, funny, funnyvideos, fypp",anxietycouple,125400,501,8211,1569
2,26,suara asli - Dezalyr.,"girlslove, butterflies, advice, girlscode, girls, boys, girlsadvice, boysfacts, boycode, girlsfacts",liamadvice3,39000,233,5378,2502
2,28,Boundless Worship - Josué Novais Piano Worship,"motivation, startlivingyourlifenow, insparation, relationship, life",dailymotivationcult,1500000,19600,378200,132700
3,0,nightcrawler instrumental - audios,"pc, gaming, roblox, ok2yk, viral, techtok, setup",ok2yk,27600,6502,11600,864
3,1,original sound - PodPill,"whateverpodcast, fyp",podpill_,68100,11100,5219,2349
3,3,Love You So - The King Khan & BBQ Show,,fosddddooo1,19400,4346,7754,6959
3,4,original sound - Marty & Elaine👨🏻‍🍳💞👩🏼‍🍳,"cooking, recipe, food, yummy, viral, fyp, foryou, dri, gaming, football, sports, foryoupage, family, yum, foodie, wow, mexicanfood",elainecarolskitchen,197400,10400,19100,11700
3,5,original sound - Adijat k Asekun,"fypadijatkasekun, nigeriamovietrending, fyp%E3%82%B7%E3%82%9Aviral, foryoupage",adijatkuburaaseku,437300,2455,29400,74400
3,7,original sound - Meme Hub 😂🤣💀,"xyzbca, foryou, difficultchallenge%F0%9F%98%82, meme, viraltiktok, capcut, fyp%E3%82%B7%E3%82%9Aviral, blowup%3F",memehubofficialaccount,4200000,32100,610300,139100
3,13,original sound - Josh Liljenquist,,joshlilj,478600,7264,16400,3711
3,16,son original - Soliste,"8mile, eminem, battle, respect, charisme, rap, musique, films, movies, meilleurmoment, capcut",soliste53,13000,132,987,255
3,18,original sound - yincard,"redditparanormal, scaryredditstories, yincardify, horrorstories, fyppppppppppppppppppppppp, horroredit, reddit, fyppp, horrortok, redditstories",yincardify,179000,573,15600,264
3,19,original sound - ashley rose,,ashleyroseclips,47200,194,2500,43
3,21,original sound - Lustra Clear,"fyp, crushes, butterflies, boys, girls, signs",lustraclear,207500,4942,37000,60800
3,22,Let him cook x Imperius on all platforms - Caleb,,array318,1600000,7813,130199,22500
3,23,original sound - Motivationzclub,"viral, magic, christian, funnyvideo, jesus, fyp%E3%82%B7, dailyquotes, fyp, cops",motivationzclub8,1600000,2808,91200,33300
3,26,original sound - Chris and jasmin,"surprise, drama, fyp, viral, trending",chrisandjasmin,13600,318,1732,205
4,1,original sound - Funnyvideo,,funclip_no4,229100,1359,23400,6508
4,5,original sound - Logan,"@lalisa_man0ban_123, top10, mostbeautiful, ranksie, fyp",good.sneeds,87300,22500,17600,22300
4,9,original sound - Greater_Movie_2nd,"bottle, police, jesus, god, fyp%E3%82%B7%E3%82%9Aviral, greater_movie",greater_movie_2nd,782800,4167,72500,78400
4,12,original sound - Didios,"crush, facts",didiios,161900,9484,20200,97800
4,13,The Night We Met - Marianne Beaulieu,"bigmkway, justiceforjournee, justiceforj, mkandjheavelychats, justiceformysister%E2%9D%A4%EF%B8%8F",mk.dadoll,5500000,32200,538100,15800
4,14,Someone Like You (Instrumental Version) - Professional Piano,"blindcat, cat, catlove",blind_cat_dmitri,212400,45900,41500,10600
4,16,original sound - Peet Montzingo,,peetmontzingo,1300000,6602,105400,44000
4,19,original sound - laundromatmoney,"vendingmachine, money, business",laundromatmoney,1400000,2737,76600,8011
4,22,original sound - goose_2659,,goose_2459,73100,1215,4590,10700
4,24,Brutus (Instrumental) - The Buttress,"creepy, horror, scary, spooky, haunted",spooky.states,30900,4346,11100,919
4,25,الصوت الأصلي - مرام الادلبيه,"capcut, humor, %D9%85%D8%B3%D9%84%D8%B3%D9%84%D8%A7%D8%AA, %D9%85%D8%B3%D9%84%D8%B3%D9%84%D8%A7%D8%AA_%D8%B3%D9%88%D8%B1%D9%8A%D8%A9, %D8%A7%D9%83%D8%B3%D8%A8%D9%84%D9%88%D8%B1, %D8%A7%D9%83%D8%B3%D8%A8%D9%84%D9%88%D8%B1explore, %D9%85%D8%B4%D8%A7%D9%87%D9%8A%D8%B1_%D8%AA%D9%8A%D9%83_%D8%AA%D9%88%D9%83, %D8%AA%D8%B1%D9%86%D8%AF, %D8%AF%D8%B1%D8%A7%D9%85%D8%A7, %D8%AF%D9%8A%D8%AA%D9%88, %D8%AA%D9%8A%D9%83_%D8%AA%D9%88%D9%83",mariam196600,17100,74,975,459
4,26,original sound - Lustra Clear,"fyp%E3%82%B7, randomfacts, viral",lustraclear,245000,54200,21600,109900
4,27,original sound - ⠀ ⠀ ⠀ ⠀ ⠀,,nevaaadaa,312800,3268,33700,1878
5,0,original sound - hunjoe,,hunjoe,140800,636,20200,712
5,1,Love of My Life (Live) - rifky aden,"@kingofdarkhumor69, blindcat, catlove, cattok",blind_cat_dmitri,2100000,196400,271300,47000
5,6,Yellow - S l o w e d • S o n g s,"cutedoggy, doglovers, petlovers, goldenretrieverpuppy, babytucker, dog, fypdog, goldenpuppy, dogtok, goldenretriever",goldenretrievertucker,265000,101300,106200,20900
5,13,original sound - GOD MY CREATOR,,faithsolomon11,105800,30900,15500,9037
5,17,original sound - Gospel Glow,"god, godlovesyou, godisgood, jesus, jesuslovesyou, christianity, christiantiktok, lore, amen, blessed, peace, heaven, mercy, gospel, grace",dreamtcju4h,62000,23600,14100,10200
5,18,original sound - Beckyp79@,"coffee, kevinhart, funny, starbucks, starbucksdrinks, latte, funnyvideos, lmao, fyp, comedyvideo, humour, laugh, ifyouknowyouknow, fyppppppppppppppppppppppp, foryou, foryoupage, goviral, viral, floptok, xybca",beckyp79,916900,5427,85300,132000
5,19,original sound - Meinan Fan,fyp,5star.breadwinner,30900,60800,3971,848
5,20,A thousand years - Zeus,"foryou, featureme, foryourpage, tiktok, feature, share",itsdylanhannigan,102900,9873,22300,4757
5,21,original sound - allison,fyp,redhairgorl,148600,796,27800,2141
5,22,original sound - Austin and TT,"gymgirl, girlswholift, gym, gymcrush, gymtok, gymhumor, @legionathletics, @beaybl",gymoholicz,10500,17,724,37
5,25,original sound - Motivation 🚀,"mindset, lifelessons, marriage, wifey, foryou",motivation.motivated,78000,564,8191,1655
